{"alert_required":true,"attempt_id":"bbbbbbbbbbbbbbbbbbbbbbbbbbbbbbbbbbbbbbbbbbbbbbbbbbbbbbbbbbbbbbbb","attempt_status":"ambiguous","audit_digest_sha256":"aaaaaaaaaaaaaaaaaaaaaaaaaaaaaaaaaaaaaaaaaaaaaaaaaaaaaaaaaaaaaaaa","conclusion":"current row is consistent with the attempt but is not proof of inclusion","digest_sha256":"f1d75cb85aa9e9e4a35bfcc44ea74dbb995aea88c0d07fc8ec1f2ac88f0ee150","evidence":{"block":110,"expected_row_digest_sha256":"cccccccccccccccccccccccccccccccccccccccccccccccccccccccccccccccc","observed_row_digest_sha256":"cccccccccccccccccccccccccccccccccccccccccccccccccccccccccccccccc","relation":"consistent","target_identity_status":"exact","validator_uid":0},"netuid":24,"network":"finney","retry_disposition":"blocked_requires_operator","schema":"miss.computer/misscomputer-subnet/weight-reconciliation-report","schema_version":1,"submission_started":true,"validator_hotkey":"validator-hotkey"}
